{
  "apiVersion": "jarvis.dev/project-validation/v1",
  "kind": "ProjectValidationReport",
  "projectId": "token-warehouse",
  "valid": true,
  "requestRoutes": [
    {
      "contract": {
        "type": "development.implementation.requested",
        "version": 1,
        "kind": "request"
      },
      "producer": {
        "instanceId": "development",
        "moduleId": "jarvis.module.development"
      },
      "consumer": {
        "instanceId": "development",
        "moduleId": "jarvis.module.development"
      }
    }
  ],
  "satisfiedCapabilities": [
    {
      "capability": "work-items.read",
      "target": {
        "kind": "slot",
        "slot": "tickets"
      },
      "source": {
        "kind": "module-instance",
        "ref": "github"
      }
    },
    {
      "capability": "repository.write",
      "target": {
        "kind": "module-instance",
        "instanceId": "development"
      },
      "source": {
        "kind": "repository",
        "ref": "repository/main"
      }
    }
  ],
  "findings": [],
  "compositionFingerprint": "ca0cffeba5686ec66a1c4aac725687da140d85232f95a7062c1fc618ce47b843"
}
